{
  "trace_version": "1.1",
  "generation_run_id": "run_20261005T072410Z_5968fcd833a5",
  "attempt": 2,
  "model_name": "deepseek-v4-pro",
  "prompt_hash": "61f05450f66d1b86518d755d0ff3adbc7f569ffe7429e086830b9f27517cbb9e",
  "prompt_text": "=== Instructions ===\nReturn only one JSON object for the semantic portion of a HarnessSpec.\nDo not emit Markdown, explanations, source code, Helper calls, Strategy Primitives, or Builder-owned fields. Every source reference must use the supplied API Profile profile_id or eligible Knowledge knowledge_id together with an exact source_path from the compact view; never use nested evidence IDs. Helper Profiles are capability context and must never be cited as semantic evidence. Every eligible Helper remains available. The fallback index is for capability discovery only; do not infer unstated constraints or behavior from its summaries. Fixed crash, signal, sanitizer, timeout, hang, and OOM monitoring belongs to the Runner and must not be emitted as branch-local checks.\n\n=== Mode Constraints ===\nIn bug-aware mode, do not emit a default branch. Return only knowledge_directed branches; the Builder injects the exact validated canonical Baseline default before semantic validation.\n\n=== Contract ===\n{\"contract_version\":\"2.4\",\"contract_name\":\"knowledge_v3_to_harness_spec\",\"target_schema_version\":\"2.2\",\"input_unit\":\"one target API bundle containing one API Profile, one mode-independent Helper capability set, and reviewed same-API Knowledge v3 records\",\"response_requirements\":{\"output_format\":\"json_only\",\"root_object_keys\":[\"knowledge_plan\",\"validity_constraints\",\"exploration_plan\"],\"script_owned_fields_not_to_emit\":[\"schema_version\",\"identity\",\"revision_information\",\"target_context\",\"knowledge_plan.knowledge_decisions[].knowledge_ref\",\"exploration_plan.default_branch_id\",\"exploration_plan.budget_policy_ref\",\"exploration_plan.branches[].budget_share\",\"provenance\",\"review\"]},\"response_template\":{\"knowledge_plan\":{\"knowledge_decisions\":[]},\"validity_constraints\":{\"global_constraints\":[]},\"exploration_plan\":{\"branches\":[]}},\"item_templates\":{\"source_ref\":{\"source_type\":null,\"source_id\":null,\"source_path\":null},\"predicate\":{\"predicate_id\":null,\"arguments\":{},\"description\":null},\"spec_element_ref\":{\"branch_id\":null,\"element_type\":null,\"element_id\":null},\"knowledge_component_mapping\":{\"source_path\":null,\"mapping_status\":null,\"spec_element_refs\":[],\"represented_scope\":null,\"deferred_scope\":null,\"decision_summary\":null},\"knowledge_decision\":{\"knowledge_id\":null,\"disposition\":null,\"branch_ids\":[],\"decision_summary\":null,\"component_mappings\":[]},\"constraint\":{\"constraint_id\":null,\"subjects\":[],\"predicate\":null,\"source_refs\":[]},\"target_condition\":{\"condition_id\":null,\"role\":null,\"predicate\":null,\"observe_at\":[],\"source_refs\":[]},\"behavior_observation\":{\"observation_id\":null,\"subject_refs\":[],\"observe_at\":null,\"description\":null,\"source_refs\":[]},\"behavior_check\":{\"check_id\":null,\"subject_refs\":[],\"preconditions\":[],\"expected_predicate\":null,\"source_refs\":[],\"requirement_level\":null},\"exploration_branch\":{\"branch_id\":null,\"branch_kind\":null,\"input_validity_intent\":null,\"input_validity_basis\":{\"basis_kind\":null,\"source_refs\":[],\"summary\":null},\"source_knowledge_ids\":[],\"grouping_summary\":null,\"exploration_goal\":null,\"exploration_goal_source_refs\":[],\"branch_constraints\":[],\"target_conditions\":[],\"behavior_observations\":[],\"behavior_checks\":[]}},\"allowed_values\":{\"source_type\":[\"api_profile\",\"knowledge\"],\"disposition\":[\"included\",\"deferred\"],\"branch_kind\":[\"default\",\"knowledge_directed\"],\"input_validity_intent\":[\"expected_valid\",\"intentionally_invalid\",\"contract_boundary_unresolved\"],\"input_validity_basis_kind\":[\"api_contract\",\"canonical_baseline_definition\",\"unresolved\"],\"knowledge_mapping_status\":[\"represented\",\"partially_represented\",\"deferred\"],\"spec_element_type\":[\"exploration_goal\",\"branch_constraint\",\"target_condition\",\"behavior_observation\",\"behavior_check\"],\"target_condition_role\":[\"activation_required\",\"exploration_variable\"],\"observation_point\":[\"before_target_api_call\",\"after_target_api_call\",\"on_target_api_termination\"],\"requirement_level\":[\"required\",\"preferred\"],\"predicate_id\":[\"property_relation\",\"set_membership\",\"range_constraint\",\"cross_subject_relation\",\"state_transition\",\"expected_exception\",\"result_equivalence\",\"output_property\",\"resource_bound\"]},\"predicate_contracts\":{\"property_relation\":{\"required_arguments\":[\"subject_ref\",\"property_ref\",\"operator\",\"value\"],\"operators\":[\"equals\",\"not_equals\",\"less_than\",\"less_or_equal\",\"greater_than\",\"greater_or_equal\"]},\"set_membership\":{\"required_arguments\":[\"subject_ref\",\"property_ref\",\"operator\",\"values\"],\"operators\":[\"in\",\"not_in\"]},\"range_constraint\":{\"required_arguments\":[\"subject_ref\",\"property_ref\",\"lower_bound\",\"upper_bound\",\"lower_inclusive\",\"upper_inclusive\"]},\"cross_subject_relation\":{\"required_arguments\":[\"left_subject_ref\",\"left_property_ref\",\"relation\",\"right_subject_ref\",\"right_property_ref\"],\"relations\":[\"equals\",\"not_equals\",\"less_than\",\"less_or_equal\",\"greater_than\",\"greater_or_equal\",\"broadcastable_with\",\"same_shape_as\",\"aliases\",\"not_aliases\",\"shares_storage_with\"]},\"state_transition\":{\"required_arguments\":[\"subject_ref\",\"property_ref\",\"transition\"],\"transitions\":[\"changed\",\"unchanged\",\"increased\",\"decreased\",\"created\",\"removed\"]},\"expected_exception\":{\"required_arguments\":[\"execution_ref\",\"exception_class\"]},\"result_equivalence\":{\"required_arguments\":[\"left_subject_ref\",\"right_subject_ref\",\"comparison\"]},\"output_property\":{\"required_arguments\":[\"subject_ref\",\"property_ref\",\"operator\",\"value\"]},\"resource_bound\":{\"required_arguments\":[\"subject_ref\",\"property_ref\",\"operator\",\"value\"]}},\"source_paths\":{\"api_profile\":\"Use an exact JSON Pointer into the supplied compact API Profile view.\",\"knowledge\":\"Use /learned_hypothesis, an exact /learned_hypothesis/limitations/<index> path, or an exact item path under /exploration_guidance/historical_anchors, /variation_opportunities, or /observation_candidates.\"},\"semantic_response_schema\":{\"$schema\":\"https://json-schema.org/draft/2020-12/schema\",\"type\":\"object\",\"additionalProperties\":false,\"required\":[\"knowledge_plan\",\"validity_constraints\",\"exploration_plan\"],\"properties\":{\"knowledge_plan\":{\"type\":\"object\",\"additionalProperties\":false,\"required\":[\"knowledge_decisions\"],\"properties\":{\"knowledge_decisions\":{\"type\":\"array\",\"items\":{\"$ref\":\"#/$defs/knowledge_decision\"}}}},\"validity_constraints\":{\"type\":\"object\",\"additionalProperties\":false,\"required\":[\"global_constraints\"],\"properties\":{\"global_constraints\":{\"type\":\"array\",\"items\":{\"$ref\":\"#/$defs/constraint\"}}}},\"exploration_plan\":{\"type\":\"object\",\"additionalProperties\":false,\"required\":[\"branches\"],\"properties\":{\"branches\":{\"type\":\"array\",\"items\":{\"$ref\":\"#/$defs/exploration_branch\"}}}}},\"$defs\":{\"non_empty_string\":{\"type\":\"string\",\"minLength\":1},\"nullable_string\":{\"type\":[\"string\",\"null\"],\"minLength\":1},\"identifier\":{\"type\":\"string\",\"minLength\":1},\"property_path\":{\"type\":\"string\",\"pattern\":\"^[a-z][a-z0-9_]*(\\\\.[a-z][a-z0-9_]*)*$\"},\"json_value\":{\"oneOf\":[{\"type\":\"null\"},{\"type\":\"boolean\"},{\"type\":\"number\"},{\"type\":\"string\"},{\"type\":\"array\",\"items\":{\"$ref\":\"#/$defs/json_value\"}},{\"type\":\"object\",\"additionalProperties\":{\"$ref\":\"#/$defs/json_value\"}}]},\"source_ref\":{\"type\":\"object\",\"additionalProperties\":false,\"required\":[\"source_type\",\"source_id\",\"source_path\"],\"properties\":{\"source_type\":{\"enum\":[\"api_profile\",\"knowledge\"]},\"source_id\":{\"$ref\":\"#/$defs/identifier\"},\"source_path\":{\"type\":\"string\",\"pattern\":\"^/\"}}},\"predicate\":{\"type\":\"object\",\"additionalProperties\":false,\"required\":[\"predicate_id\",\"arguments\"],\"properties\":{\"predicate_id\":{\"enum\":[\"property_relation\",\"set_membership\",\"range_constraint\",\"cross_subject_relation\",\"state_transition\",\"expected_exception\",\"result_equivalence\",\"output_property\",\"resource_bound\"]},\"arguments\":{\"type\":\"object\",\"patternProperties\":{\"^(property_ref|left_property_ref|right_property_ref)$\":{\"$ref\":\"#/$defs/property_path\"}},\"additionalProperties\":{\"$ref\":\"#/$defs/json_value\"}},\"description\":{\"$ref\":\"#/$defs/nullable_string\"}}},\"spec_element_ref\":{\"type\":\"object\",\"additionalProperties\":false,\"required\":[\"branch_id\",\"element_type\",\"element_id\"],\"properties\":{\"branch_id\":{\"$ref\":\"#/$defs/identifier\"},\"element_type\":{\"enum\":[\"exploration_goal\",\"branch_constraint\",\"target_condition\",\"behavior_observation\",\"behavior_check\"]},\"element_id\":{\"oneOf\":[{\"$ref\":\"#/$defs/identifier\"},{\"type\":\"null\"}]}}},\"component_mapping\":{\"type\":\"object\",\"additionalProperties\":false,\"required\":[\"source_path\",\"mapping_status\",\"spec_element_refs\"],\"properties\":{\"source_path\":{\"type\":\"string\",\"pattern\":\"^/\"},\"mapping_status\":{\"enum\":[\"represented\",\"partially_represented\",\"deferred\"]},\"spec_element_refs\":{\"type\":\"array\",\"uniqueItems\":true,\"items\":{\"$ref\":\"#/$defs/spec_element_ref\"}},\"represented_scope\":{\"$ref\":\"#/$defs/nullable_string\"},\"deferred_scope\":{\"$ref\":\"#/$defs/nullable_string\"},\"decision_summary\":{\"$ref\":\"#/$defs/nullable_string\"}},\"allOf\":[{\"if\":{\"properties\":{\"mapping_status\":{\"const\":\"represented\"}},\"required\":[\"mapping_status\"]},\"then\